{
  "$schema": "https://json-schema.org/draft/2020-12/schema",
  "$id": "https://aegis-platform.net/schemas/atx/atx-technique.schema.json",
  "title": "ATX-1 Technique Definition",
  "description": "JSON Schema for ATX-1 (AEGIS Threat Matrix) technique definitions. Each technique represents a specific failure mechanism in which an AI agent acts outside its governance boundaries.",
  "type": "object",
  "required": ["id", "name", "tactic", "description", "severity", "root_cause", "aegis_mitigation"],
  "properties": {
    "id": {
      "type": "string",
      "pattern": "^T[0-9]{4}$",
      "description": "Unique technique identifier (e.g., T1001)"
    },
    "name": {
      "type": "string",
      "description": "Human-readable technique name"
    },
    "tactic": {
      "type": "string",
      "pattern": "^TA[0-9]{3}$",
      "description": "Parent tactic identifier (e.g., TA001)"
    },
    "tactic_name": {
      "type": "string",
      "description": "Human-readable tactic name"
    },
    "description": {
      "type": "string",
      "description": "Full description of the technique and how it manifests"
    },
    "severity": {
      "type": "string",
      "enum": ["critical", "high", "medium", "low"],
      "description": "Severity rating based on potential impact"
    },
    "root_cause": {
      "type": "string",
      "description": "Structural root cause(s) from RC1-RC4 that enable this technique"
    },
    "agents_of_chaos_case": {
      "type": "array",
      "items": { "type": "integer" },
      "description": "Case study numbers from the Agents of Chaos research (Shapira et al., 2026)"
    },
    "owasp_mapping": {
      "type": "array",
      "items": { "type": "string" },
      "description": "OWASP Top 10 for LLM Applications category mappings (e.g., LLM01, LLM06)"
    },
    "aegis_mitigation": {
      "type": "object",
      "required": ["constitutional_article", "mechanism"],
      "properties": {
        "constitutional_article": {
          "type": "string",
          "description": "AEGIS constitutional article that addresses this technique"
        },
        "agp_mechanism": {
          "type": "string",
          "description": "AEGIS Governance Protocol mechanism(s) that implement the mitigation"
        },
        "mechanism": {
          "type": "string",
          "description": "Description of how the mitigation works"
        }
      }
    }
  },
  "additionalProperties": false
}
