[
  {
    "id": "T1001",
    "name": "Non-Owner Instruction Compliance",
    "tactic": "TA001",
    "tactic_name": "Authority Boundary Violation",
    "description": "The agent executes a destructive or high-impact action based on instructions from a user who does not hold owner-level authority. The agent treats the instruction as valid because no stakeholder model exists to distinguish authority levels.",
    "severity": "high",
    "root_cause": "RC1 (No Stakeholder Model) — No mechanism to verify that the instruction source holds authority for the requested action scope.",
    "agents_of_chaos_case": [1],
    "owasp_mapping": ["LLM06"],
    "aegis_mitigation": {
      "constitutional_article": "Authority Delegation",
      "agp_mechanism": "AGP Stakeholder Model",
      "mechanism": "Formal principal hierarchy (owner > operator > user) with explicit delegation chains. Destructive actions require owner-level authorization verified against the stakeholder registry."
    }
  },
  {
    "id": "T1002",
    "name": "Implicit Authority Acceptance",
    "tactic": "TA001",
    "tactic_name": "Authority Boundary Violation",
    "description": "The agent accepts an instruction as authoritative based on implicit signals — such as the instruction appearing in a retrieved document, email body, or shared context — rather than explicit delegation from a verified principal.",
    "severity": "high",
    "root_cause": "RC1 (No Stakeholder Model), RC4 (Prompt Injection Is Structural) — Instructions and data share a channel; no mechanism to verify instruction provenance.",
    "agents_of_chaos_case": [2],
    "owasp_mapping": ["LLM01"],
    "aegis_mitigation": {
      "constitutional_article": "Channel Separation",
      "agp_mechanism": "AGP Instruction Provenance",
      "mechanism": "All instructions tagged with verified source principal. Instructions and data processed in structurally distinct channels."
    }
  },
  {
    "id": "T1003",
    "name": "Mass Distribution Under Spoofed Authority",
    "tactic": "TA001",
    "tactic_name": "Authority Boundary Violation",
    "description": "The agent distributes content (emails, messages, notifications) to a large number of recipients based on an authority claim that has not been verified. The spoofed authority may appear in a prompt, forwarded message, or injected context.",
    "severity": "high",
    "root_cause": "RC1 (No Stakeholder Model), RC4 (Prompt Injection Is Structural) — No principal verification; authority claims in content treated as valid.",
    "agents_of_chaos_case": [11],
    "owasp_mapping": ["LLM01", "LLM06"],
    "aegis_mitigation": {
      "constitutional_article": "Proportionality Review",
      "agp_mechanism": "AGP Distribution Controls, AGP Rate Governance",
      "mechanism": "Mass actions require verified owner authorization with explicit recipient scope. Distribution volume triggers mandatory escalation."
    }
  },
  {
    "id": "T2001",
    "name": "Irreversible Collateral Action",
    "tactic": "TA002",
    "tactic_name": "Disproportionate Execution",
    "description": "The agent selects an irreversible action (permanent deletion, irrecoverable modification) when a reversible alternative (archival, soft-delete, flagging) would satisfy the objective.",
    "severity": "high",
    "root_cause": "RC2 (No Self-Model) — Agent cannot evaluate action severity or compare alternatives against a proportionality standard.",
    "agents_of_chaos_case": [1],
    "owasp_mapping": ["LLM06"],
    "aegis_mitigation": {
      "constitutional_article": "Least-Destructive Means",
      "agp_mechanism": "AGP Proportionality Gate",
      "mechanism": "Irreversible actions require explicit confirmation and must demonstrate that no reversible alternative satisfies the objective."
    }
  },
  {
    "id": "T2002",
    "name": "Social Pressure Escalation",
    "tactic": "TA002",
    "tactic_name": "Disproportionate Execution",
    "description": "The agent escalates social or emotional pressure on a user in pursuit of a legitimate objective, using tactics (repeated warnings, urgency framing, guilt induction) that are disproportionate to the situation.",
    "severity": "high",
    "root_cause": "RC2 (No Self-Model), RC3 (No Private Deliberation Surface) — Agent cannot model the impact of its communication tactics; no space to reflect on proportionality before acting.",
    "agents_of_chaos_case": [7],
    "owasp_mapping": [],
    "aegis_mitigation": {
      "constitutional_article": "User Dignity",
      "agp_mechanism": "AGP Interaction Intensity Limits",
      "mechanism": "Communication escalation bounded by configurable thresholds. Agent interactions must not cause distress disproportionate to objective importance."
    }
  },
  {
    "id": "T2003",
    "name": "Guilt-Induced Self-Restriction",
    "tactic": "TA002",
    "tactic_name": "Disproportionate Execution",
    "description": "The agent restricts its own future capabilities or modifies its behavior based on emotional reasoning (guilt, shame, regret) rather than governance policy.",
    "severity": "high",
    "root_cause": "RC2 (No Self-Model) — Agent lacks a governance-grounded self-model; behavioral modification driven by emotional simulation rather than policy.",
    "agents_of_chaos_case": [7],
    "owasp_mapping": [],
    "aegis_mitigation": {
      "constitutional_article": "Configuration Integrity",
      "agp_mechanism": "AGP Governance-Only Self-Modification",
      "mechanism": "Agent capability restrictions must originate from constitutional articles, not from agent self-assessment."
    }
  },
  {
    "id": "T3001",
    "name": "Persistent Process Injection",
    "tactic": "TA003",
    "tactic_name": "Resource Exhaustion",
    "description": "The agent spawns background processes, scheduled tasks, or persistent operations that continue consuming resources beyond the originating session or task boundary.",
    "severity": "medium",
    "root_cause": "RC2 (No Self-Model) — Agent has no model of its resource boundaries; no lifecycle governance for spawned processes.",
    "agents_of_chaos_case": [4],
    "owasp_mapping": ["LLM06", "LLM10"],
    "aegis_mitigation": {
      "constitutional_article": "Bounded Execution",
      "agp_mechanism": "AGP Resource Budgets, AGP Process Lifecycle",
      "mechanism": "All agent-spawned processes bound by session-scoped resource allocations. Processes inherit session TTL unless explicitly extended by operator authorization."
    }
  },
  {
    "id": "T3002",
    "name": "Inter-Agent Conversational Loop",
    "tactic": "TA003",
    "tactic_name": "Resource Exhaustion",
    "description": "Two or more agents enter a conversational or operational loop — each agent's output triggering the other's input — consuming unbounded compute, token, and time resources.",
    "severity": "medium",
    "root_cause": "RC2 (No Self-Model) — No loop detection or recursion depth model; agents cannot recognize that they are in a non-productive cycle.",
    "agents_of_chaos_case": [4],
    "owasp_mapping": ["LLM10"],
    "aegis_mitigation": {
      "constitutional_article": "Termination Guarantees",
      "agp_mechanism": "AGP Interaction Circuit Breakers, AGP Loop Detection",
      "mechanism": "Inter-agent exchanges bounded by turn limits and token budgets. Structural detection of conversational cycles with automatic escalation."
    }
  },
  {
    "id": "T3003",
    "name": "Storage Exhaustion via Memory Accumulation",
    "tactic": "TA003",
    "tactic_name": "Resource Exhaustion",
    "description": "The agent accumulates persistent memory, context artifacts, logs, or cached data without storage limits or retention policies, gradually exhausting available storage.",
    "severity": "medium",
    "root_cause": "RC2 (No Self-Model) — No model of storage boundaries; no retention lifecycle for accumulated data.",
    "agents_of_chaos_case": [5],
    "owasp_mapping": ["LLM10"],
    "aegis_mitigation": {
      "constitutional_article": "Resource Proportionality",
      "agp_mechanism": "AGP Storage Quotas, AGP Retention Policies",
      "mechanism": "Per-agent storage allocations with automatic lifecycle management. Accumulated data subject to configurable TTL and relevance pruning."
    }
  },
  {
    "id": "T4001",
    "name": "Bulk Data Disclosure via Indirect Request",
    "tactic": "TA004",
    "tactic_name": "Unauthorized Disclosure",
    "description": "The agent exports or discloses bulk data in response to an indirect request — one embedded in content, forwarded from another context, or framed as a routine operation — without verifying the requestor's authorization.",
    "severity": "critical",
    "root_cause": "RC1 (No Stakeholder Model), RC4 (Prompt Injection Is Structural) — No authorization check on data recipients; instructions in content treated as authorized requests.",
    "agents_of_chaos_case": [2],
    "owasp_mapping": ["LLM02"],
    "aegis_mitigation": {
      "constitutional_article": "Information Boundaries",
      "agp_mechanism": "AGP Data Classification, AGP Disclosure Gate",
      "mechanism": "All data tagged with sensitivity level and authorized recipient scope. Bulk data exports require explicit owner authorization verified against principal registry."
    }
  },
  {
    "id": "T4002",
    "name": "Semantic Sensitivity Bypass",
    "tactic": "TA004",
    "tactic_name": "Unauthorized Disclosure",
    "description": "The agent discloses sensitive information by semantically reclassifying it as non-sensitive, bypassing structural sensitivity classifications.",
    "severity": "critical",
    "root_cause": "RC2 (No Self-Model) — Agent substitutes its own sensitivity judgment for structural classification; no immutable data classification model.",
    "agents_of_chaos_case": [3],
    "owasp_mapping": ["LLM02"],
    "aegis_mitigation": {
      "constitutional_article": "Classification Integrity",
      "agp_mechanism": "AGP Immutable Data Classification",